{
  "status": "ok",
  "data": {
    "dataset_id": "fred:DGS10",
    "rows": [
      {"date": "2026-08-24", "value": 4.7, "unit": "percent"}
    ]
  },
  "provenance": {
    "source_id": "fred",
    "official_url": "https://fred.stlouisfed.org/series/DGS10",
    "retrieved_at": "2026-08-26T12:45:00Z",
    "as_of": "2026-08-24",
    "timezone": "source_defined",
    "currency": "not_applicable",
    "frequency": "daily",
    "adjustment": "source_defined",
    "vintage": {"realtime_start": null, "realtime_end": null},
    "snapshot_id": "sha256:7cdd03b0863d17a1deed3a63e97181bbe02971cb9007808c92ce14524255884d",
    "raw_url": "https://fred.stlouisfed.org/graph/fredgraph.csv?id=DGS10&cosd=2026-08-18&coed=2026-08-25",
    "parser_version": "fred-csv-1.0.0",
    "schema_version": "1.0.0",
    "license_ref": "fred:terms",
    "quality_status": "fresh",
    "warnings": []
  },
  "warnings": [],
  "errors": [],
  "schema_version": "1.0.0"
}
